{
  "$schema": "http://json-schema.org/draft-07/schema#",
  "$id": "https://github.com/Sreeram-ganesan/jaunt-data-scout/schemas/frontier.maps.json",
  "title": "Maps Frontier Message",
  "description": "Schema for maps frontier messages used in the data scout pipeline",
  "type": "object",
  "required": ["type", "city", "lat", "lng", "radius", "correlation_id"],
  "properties": {
    "type": {
      "type": "string",
      "const": "maps",
      "description": "Message type identifier"
    },
    "city": {
      "type": "string",
      "description": "Target city for data collection",
      "minLength": 1
    },
    "lat": {
      "type": "number",
      "minimum": -90.0,
      "maximum": 90.0,
      "description": "Latitude coordinate for the search center"
    },
    "lng": {
      "type": "number",
      "minimum": -180.0,
      "maximum": 180.0,
      "description": "Longitude coordinate for the search center"
    },
    "radius": {
      "type": "integer",
      "minimum": 50,
      "maximum": 50000,
      "description": "Search radius in meters"
    },
    "category": {
      "type": "string",
      "description": "Optional place category to filter by",
      "examples": ["restaurant", "tourist_attraction", "museum", "park", "hotel"]
    },
    "correlation_id": {
      "type": "string",
      "pattern": "^[a-f0-9]{8}-[a-f0-9]{4}-[a-f0-9]{4}-[a-f0-9]{4}-[a-f0-9]{12}$",
      "description": "UUID for tracking requests across the pipeline"
    },
    "trust_score": {
      "type": "number",
      "minimum": 0.0,
      "maximum": 1.0,
      "description": "Optional trust score for the source (0.0 to 1.0)"
    },
    "coordinates_confidence": {
      "type": "number",
      "minimum": 0.0,
      "maximum": 1.0,
      "description": "Optional confidence score for coordinate accuracy"
    },
    "priority": {
      "type": "string",
      "enum": ["low", "medium", "high"],
      "default": "medium",
      "description": "Processing priority for this message"
    },
    "search_type": {
      "type": "string",
      "enum": ["nearby", "text", "details"],
      "default": "nearby",
      "description": "Type of maps API search to perform"
    },
    "place_types": {
      "type": "array",
      "items": {
        "type": "string"
      },
      "description": "Array of Google Places API place types to include",
      "examples": [["restaurant", "food"], ["tourist_attraction", "point_of_interest"]]
    },
    "metadata": {
      "type": "object",
      "description": "Additional metadata for the maps search",
      "properties": {
        "anchor_place_id": {
          "type": "string",
          "description": "Reference place ID for expansion searches"
        },
        "search_depth": {
          "type": "integer",
          "minimum": 0,
          "maximum": 3,
          "description": "Depth level for expansion searches"
        },
        "h3_cell": {
          "type": "string",
          "description": "H3 cell identifier for geographic clustering"
        }
      },
      "additionalProperties": false
    }
  },
  "additionalProperties": false
}